{
  "$schema": "https://json-schema.org/draft/2020-12/schema",
  "$id": "https://cityscroll.org/schemas/architecture-evidence-entry.v1.schema.json",
  "title": "CityScroll architecture-evidence entry",
  "type": "object",
  "additionalProperties": false,
  "required": [
    "schema",
    "id",
    "status",
    "fingerprint",
    "updated_at",
    "projections"
  ],
  "properties": {
    "schema": {
      "const": "cityscroll.architecture-evidence-entry.v1"
    },
    "id": {
      "type": "string",
      "minLength": 1,
      "pattern": "^[a-z0-9]+(?:[._-][a-z0-9]+)*(?:/[a-z0-9]+(?:[._-][a-z0-9]+)*)*$"
    },
    "status": {
      "type": "string",
      "minLength": 1
    },
    "fingerprint": {
      "type": "string",
      "minLength": 1
    },
    "updated_at": {
      "type": "string",
      "minLength": 1
    },
    "projections": {
      "type": "array",
      "minItems": 1,
      "items": {
        "type": "object",
        "additionalProperties": false,
        "required": ["id", "path"],
        "properties": {
          "id": { "type": "string", "minLength": 1 },
          "path": { "type": "string", "minLength": 1 }
        }
      }
    }
  }
}
