{
  "schema": "cityscroll.architecture-evidence-entry.v1",
  "id": "cityscroll-land-map-view/lm-05-route-lazy-shell",
  "status": "implemented",
  "fingerprint": "lm-05-route-lazy-shell.v1",
  "updated_at": "2026-09-01T00:00:00.000Z",
  "projections": [
    {
      "id": "land-map-runtime",
      "path": "site/app/map_runtime.mjs"
    },
    {
      "id": "land-map-route-lazy-shell-receipt",
      "path": "docs/evidence/land-map-route-lazy-shell.json"
    }
  ]
}
