{
  "schema": "cityscroll.architecture-evidence-entry.v1",
  "id": "cityscroll-engineering/location-evidence-tier",
  "status": "implemented",
  "fingerprint": "location-evidence-tier.v1",
  "updated_at": "2026-09-04T00:00:00.000Z",
  "projections": [
    {
      "id": "location-evidence-tier-contract",
      "path": "site/location_evidence_tier.mjs"
    },
    {
      "id": "place-role-near-you-explanation-path",
      "path": "site/near_you_explanation_path.mjs"
    },
    {
      "id": "location-evidence-tier-district-activity-precompute",
      "path": "tools/lib/district_activity.mjs"
    },
    {
      "id": "location-evidence-tier-location-derivation",
      "path": "site/location_derivation.mjs"
    },
    {
      "id": "location-evidence-tier-tests",
      "path": "test/location_evidence_tier.test.mjs"
    }
  ]
}
