{
  "schema": "cityscroll.architecture-evidence-entry.v1",
  "id": "cityscroll-api-parity/ap-c2-land-decision-path-capability",
  "status": "implemented",
  "fingerprint": "ap-c2-land-decision-path-capability.v1",
  "updated_at": "2026-09-05T00:00:00.000Z",
  "projections": [
    {
      "id": "land-decision-path-contract",
      "path": "capabilities/land_decision_path.mjs"
    },
    {
      "id": "land-decision-path-view",
      "path": "site/land_decision_path.mjs"
    },
    {
      "id": "land-decision-path-provider",
      "path": "worker/src/land_projects.mjs"
    },
    {
      "id": "land-decision-path-fixtures",
      "path": "worker/src/data/land_expedited_decision_path_fixtures.json"
    },
    {
      "id": "land-decision-path-tests",
      "path": "test/land_decision_path_capability.test.mjs"
    }
  ]
}
