{
  "schema": "cityscroll.architecture-evidence-entry.v1",
  "id": "cityscroll-seqra-foundation/a78-06-internal-challenge-watch-card",
  "status": "implemented",
  "fingerprint": "a78-06-internal-challenge-watch-card.v1",
  "updated_at": "2026-09-05T00:00:00.000Z",
  "projections": [
    {
      "id": "article78-challenge-watch-card-model",
      "path": "warehouse/lib/article78_challenge_watch_card.mjs"
    },
    {
      "id": "article78-challenge-watch-card-tests",
      "path": "test/warehouse_article78_challenge_watch_card.test.mjs"
    },
    {
      "id": "article78-challenge-watch-card-contract",
      "path": "docs/article78-challenge-watch-card-v1.md"
    }
  ]
}
