{
  "schema": "cityscroll.architecture-evidence-entry.v1",
  "id": "cityscroll-calendar-beyond-ics/cbics-09-legislative-matter-appearances",
  "status": "implemented",
  "fingerprint": "cbics-09-legislative-matter-appearances.v1",
  "updated_at": "2026-09-03T00:00:00.000Z",
  "projections": [
    {
      "id": "matter-appearance-calendar-adapter",
      "path": "site/legislative_matter_calendar.mjs"
    },
    {
      "id": "matter-document-calendar-mount",
      "path": "site/legislative_matter_document.mjs"
    }
  ]
}
